{
  "caseId": "a4391799-f828-4515-a355-61f1d5d9690c",
  "caseType": "CC",
  "defendantId": "9824e40f-0289-4221-8854-346eb28c8f27",
  "defendantName": "Defendant Name",
  "documentCategory": "Defendant level",
  "documentType": "Private section - Judges & HMCTS",
  "documentTypeId": "d2d2d2d2-2222-4222-8222-222222222222",
  "isCpsCase": false,
  "material": {
    "documentType": "Private section - Judges & HMCTS",
    "fileCloudLocation": "azure/abc.pdf",
    "fileType": "99"
  },
  "prosecutorDefendantId": "9824e40f-0289-4221-8854-346eb28c8f27",
  "receivedDateTime": "EXCLUDED",
  "sectionCode": "PSJH"
}
